{
  "took_seconds": 0.7,
  "count": 1,
  "results": [
    {
      "url": "https://www.accionlabs.com/",
      "domain": "www.accionlabs.com",
      "scraped_at": "2026-01-24T01:02:57.857223",
      "title": "Empowering Businesses Through Innovative Transformation | Accion Labs",
      "meta_description": "Accion Labs drives business growth and efficiency with innovative digital transformation, product engineering, cloud services, data analytics, and automation.",
      "headings": {
        "h1": [
          "Redefining Innovation Across Industries"
        ],
        "h2": [
          "Al-First, Platform-led Innovation Engineering Services Company",
          "Empowering GCCs to Accelerate Global Impact",
          "Impacting Lives By Transforming Businesses Through Innovations",
          "Accion Labs acquires NetServ to Strengthen Global Product Engineering Leadership",
          "Accion Labs Featured in Zinnov Zones for Digital Engineering and ER&D Services 2024 Across 18 Segments",
          "Generative AI",
          "Data Analytics & Insights",
          "Accion Labs Healthcare Unveils PBM NexaPro",
          "Al-First, Platform-led Innovation Engineering Services Company",
          "Empowering GCCs to Accelerate Global Impact",
          "Impacting Lives By Transforming Businesses Through Innovations",
          "Accion Labs acquires NetServ to Strengthen Global Product Engineering Leadership",
          "Accion Labs Featured in Zinnov Zones for Digital Engineering and ER&D Services 2024 Across 18 Segments",
          "Generative AI",
          "Data Analytics & Insights",
          "Accion Labs Healthcare Unveils PBM NexaPro",
          "Al-First, Platform-led Innovation Engineering Services Company",
          "Enhancing Lives By Transforming Businesses Through Innovation",
          "Accion Labs Featured in Zinnov Zones for Digital Engineering and ER&D Services 2024 Across 18 Segments",
          "Generative AI",
          "Data Analytics & Insights",
          "Accion Labs Healthcare Unveils PBM NexaPro",
          "Accion Labs Healthcare",
          "Al-First, Platform-led Innovation Engineering Services Company",
          "Enhancing Lives By Transforming Businesses Through Innovation",
          "Accion Labs Featured in Zinnov Zones for Digital Engineering and ER&D Services 2024 Across 18 Segments",
          "Generative AI",
          "Data Analytics & Insights",
          "Accion Labs Healthcare Unveils PBM NexaPro",
          "Accion Labs Healthcare",
          "Service Pillars Driving Innovation at Accion Labs",
          "Craft Your Future Story",
          "Technology Partners",
          "Insights",
          "Connect with Us"
        ],
        "h3": [
          "Product Engineering",
          "Product Engineering",
          "Data Analytics & Insights",
          "Data Analytics & Insights",
          "Automation",
          "Automation",
          "Cloud",
          "Cloud",
          "Digital Engineering",
          "Data and AI",
          "Cloud & Platform Engineering",
          "Enterprise System Automation",
          "Agentic AI Solutions",
          "0",
          "0",
          "0",
          "0",
          "0",
          "0",
          "0",
          "0",
          "0",
          "0",
          "0",
          "0",
          "0",
          "0",
          "0",
          "0"
        ]
      },
      "paragraphs": [
        "Unleashing the Potential of Advanced Language Comprehension",
        "Building a Secure, Sustainable and Responsible Future",
        "A Comprehensive PBM Services Unit Transforming Prescription Benefit Management",
        "Unleashing the Potential of Advanced Language Comprehension",
        "Building a Secure, Sustainable and Responsible Future",
        "A Comprehensive PBM Services Unit Transforming Prescription Benefit Management",
        "Unleashing the Potential of Advanced Language Comprehension",
        "Building a Secure, Sustainable and Responsible Future",
        "A Comprehensive PBM Services Unit Transforming Prescription Benefit Management",
        "A Comprehensive PBM Services Unit Transforming Prescription Benefit Management",
        "Unleashing the Potential of Advanced Language Comprehension",
        "Building a Secure, Sustainable and Responsible Future",
        "A Comprehensive PBM Services Unit Transforming Prescription Benefit Management",
        "A Comprehensive PBM Services Unit Transforming Prescription Benefit Management",
        "Facilitating Digital Transformation journeys by crafting highly customized Digital Products that seamlessly cater to the unique requirements and allow end-to-end interactions throughout the product lifecycle.",
        "Experience the full potential of our Data Services, where agility and data-driven expertise converge to shape customized solutions, elevate operations, and enrich experiences. Propel your transformation to a data-centric architecture by leveraging the strengths of IP accelerators on your journey with us.",
        "Take a leap forward into our advanced Automation Services, where we assess, embrace, and seamlessly integrate Innovation. Discover increased efficiency and unparalleled operational excellence tailored to thrive in the dynamic and ever-evolving business landscape.",
        "Explore our comprehensive Cloud Services, including expert cloud management and advanced cloud computing solutions, to elevate your business operations. Leverage our specialized cloud migration services to transition to a modern cloud infrastructure seamlessly.",
        "Legacy systems slow release cycles and limit innovation. Our architecture-first modernization framework reduces tech debt and accelerates product launches by 30%–50% through AI-integrated SDLC practices. From modernizing legacy platforms to building SaaS products or adding automation, we bring domain-aligned architecture and engineering depth for high-performing systems.",
        "Siloed data and opaque models create blind spots for decision-makers. We help enterprises unify fragmented data, enforce governance frameworks, and meet regulatory requirements through traceable pipelines and explainable AI. From AI-powered analytics to NLP workflows, our solutions enhance forecast accuracy, reduce compliance exposure, and shorten decision cycles.",
        "Cloud & Platform Engineering",
        "Unstructured cloud adoption often increases cost and complexity. We design cloud-native architectures using infrastructure-as-code, strong security frameworks, and automated policy enforcement. From cloud migration to hybrid orchestration, we help enterprises reduce cloud costs by 15%–30%, speed up deployments, and ensure compliance.",
        "Enterprise System Automation",
        "Fragmented workflows and manual tasks limit operational efficiency. We go beyond traditional RPA with automation frameworks that integrate business rules, support dynamic coordination, and work across legacy and modern systems. Our approach enables faster execution, policy enforcement, and real-time visibility at scale.",
        "Traditional automation struggles with tasks needing real-time adaptability. Our agentic systems, powered by BizBrain AI, KAPS, and GenAI in a Box, manage multi-step tasks with human oversight, audit trails, and compliance. These AI agents support use cases in support, development, and operations, helping enterprises move from reactive automation to intelligent autonomy.",
        "Technology Accelerators",
        "Proprietary IPs Developed",
        "GenAI Implementations Delivered",
        "Global Delivery Locations",
        "Centers of Excellence Driving Innovation",
        "Proprietary Platforms",
        "AI/GenAI Implementations",
        "Technology Accelerators",
        "Explore our industry-specific solutions designed to address the unique challenges of your business and drive growth.",
        "Our work spans mission-critical environments, where uptime, compliance, and product integrity matter. Every engagement is shaped by domain-specific experience and technical precision.",
        "Tech leaders face pressure to innovate quickly while maintaining platform stability. We help product-first organizations reduce development cycles by up to 50% and improve release predictability through domain-specific architecture, AI adoption, and scalable engineering models across SaaS platforms, developer tools, and middleware.",
        "Financial institutions must align digital strategy with audit-readiness and risk management. We implement AI for fraud detection, automate policy enforcement, and modernize transaction systems while supporting compliance with frameworks like SOC 2, PCI DSS, and GDPR. Our solutions reduce fraud investigation time by 40% and enable real-time decision support.",
        "Patient care and data privacy go hand in hand. We build HIPAA-ready platforms such as EMR-integrated front doors (patient portal solutions that unify scheduling, communication, and care coordination), pharmacy benefit management platforms, and clinical analytics engines that unify scheduling, communication, and care coordination. Our deployments prioritize traceability, access control, and interoperability.",
        "Consumer-facing brands must adapt in real time to shifting behavior, inventory signals, and pricing logic. Our commerce platforms improve conversion rates by 15%–25% and ensure consistent experiences across channels. From omnichannel personalization to AI-enabled promotions, we drive measurable lift without compromising operations.",
        "Manufacturers need reliability, traceability, and real-time coordination across supply chains and plants. We build fault-tolerant systems integrating IoT monitoring, AI-based demand forecasting, and agentic automation. Our platforms are designed to meet the performance, and compliance demands of high-stakes manufacturing environments.",
        "Edtech and educational institutions need personalized learning experiences that comply with data privacy norms. We build adaptive learning systems, AI-driven engagement layers, and scalable digital infrastructure that supports real-time insights, accessibility, and student success across hybrid formats.",
        "Grid operators and energy providers demand high availability and regulatory compliance. We build platforms that capture field telemetry, enforce grid integrity, and automate response planning. Our AI-powered systems reduce downtime, support predictive maintenance, and align with evolving energy regulations.",
        "We deliver purpose-built platforms for pharmacy benefit management (PBM), global impact organizations, digital healthcare front doors (patient portal solutions that unify scheduling, communication, and care coordination), and enterprise security vendors . Our solutions embed domain-specific rules, compliance checkpoints, and automation logic to support high-risk, high-impact environments. Every implementation aligns with regulatory expectations and operational constraints without sacrificing speed or visibility.",
        "Tech leaders face pressure to innovate quickly while maintaining platform stability. We help product-first organizations reduce development cycles by up to 50% and improve release predictability through domain-specific architecture, AI adoption, and scalable engineering models across SaaS platforms, developer tools, and middleware.",
        "Financial institutions must align digital strategy with audit-readiness and risk management. We implement AI for fraud detection, automate policy enforcement, and modernize transaction systems while supporting compliance with frameworks like SOC 2, PCI DSS, and GDPR. Our solutions reduce fraud investigation time by 40% and enable real-time decision support.",
        "Patient care and data privacy go hand in hand. We build HIPAA-ready platforms such as EMR-integrated front doors (patient portal solutions that unify scheduling, communication, and care coordination), pharmacy benefit management platforms, and clinical analytics engines that unify scheduling, communication, and care coordination. Our deployments prioritize traceability, access control, and interoperability.",
        "Consumer-facing brands must adapt in real time to shifting behavior, inventory signals, and pricing logic. Our commerce platforms improve conversion rates by 15%–25% and ensure consistent experiences across channels. From omnichannel personalization to AI-enabled promotions, we drive measurable lift without compromising operations.",
        "Manufacturers need reliability, traceability, and real-time coordination across supply chains and plants. We build fault-tolerant systems integrating IoT monitoring, AI-based demand forecasting, and agentic automation. Our platforms are designed to meet the performance, and compliance demands of high-stakes manufacturing environments.",
        "Edtech and educational institutions need personalized learning experiences that comply with data privacy norms. We build adaptive learning systems, AI-driven engagement layers, and scalable digital infrastructure that supports real-time insights, accessibility, and student success across hybrid formats.",
        "Grid operators and energy providers demand high availability and regulatory compliance. We build platforms that capture field telemetry, enforce grid integrity, and automate response planning. Our AI-powered systems reduce downtime, support predictive maintenance, and align with evolving energy regulations."
      ],
      "list_items": [
        "Capabilities Digital Engineering Services SaaS Product Development Re-engineering & Modernization Product Portfolio Rationalization Digital Experience Enhancement Emerging Tech Solutioning Data & AI Services Data Platform Modernization Advanced Analytics & Insights AI/ML Implementation Data Governance & Compliance Industry-specific Data Solutions Cloud & Platform Engineering Cloud Migration & Transformation Multi-cloud Strategy & Management Cloud Optimization & FinOps DevOps & Site Reliability Engineering Enterprise Security & Compliance Enterprise System Automation Robotic Process Automation Business Process Transformation API Management & System Integration Low-code/No-code Development Agentic Workflow Automation",
        "Digital Engineering Services SaaS Product Development Re-engineering & Modernization Product Portfolio Rationalization Digital Experience Enhancement Emerging Tech Solutioning",
        "SaaS Product Development",
        "Re-engineering & Modernization",
        "Product Portfolio Rationalization",
        "Digital Experience Enhancement",
        "Emerging Tech Solutioning",
        "Data & AI Services Data Platform Modernization Advanced Analytics & Insights AI/ML Implementation Data Governance & Compliance Industry-specific Data Solutions",
        "Data Platform Modernization",
        "Advanced Analytics & Insights",
        "AI/ML Implementation",
        "Data Governance & Compliance",
        "Industry-specific Data Solutions",
        "Cloud & Platform Engineering Cloud Migration & Transformation Multi-cloud Strategy & Management Cloud Optimization & FinOps DevOps & Site Reliability Engineering Enterprise Security & Compliance",
        "Cloud Migration & Transformation",
        "Multi-cloud Strategy & Management",
        "Cloud Optimization & FinOps",
        "DevOps & Site Reliability Engineering",
        "Enterprise Security & Compliance",
        "Enterprise System Automation Robotic Process Automation Business Process Transformation API Management & System Integration Low-code/No-code Development Agentic Workflow Automation",
        "Robotic Process Automation",
        "Business Process Transformation",
        "API Management & System Integration",
        "Low-code/No-code Development",
        "Agentic Workflow Automation",
        "Capabilities Digital Engineering Services SaaS Product Development Re-engineering & Modernization Product Portfolio Rationalization Digital Experience Enhancement Emerging Tech Solutioning Data & AI Services Data Platform Modernization Advanced Analytics & Insights AI/ML Implementation Data Governance & Compliance Industry-specific Data Solutions Cloud & Platform Engineering Cloud Migration & Transformation Multi-cloud Strategy & Management Cloud Optimization & FinOps DevOps & Site Reliability Engineering Enterprise Security & Compliance Enterprise System Automation Robotic Process Automation Business Process Transformation API Management & System Integration Low-code/No-code Development Agentic Workflow Automation",
        "Digital Engineering Services SaaS Product Development Re-engineering & Modernization Product Portfolio Rationalization Digital Experience Enhancement Emerging Tech Solutioning",
        "SaaS Product Development",
        "Re-engineering & Modernization",
        "Product Portfolio Rationalization",
        "Digital Experience Enhancement",
        "Emerging Tech Solutioning",
        "Data & AI Services Data Platform Modernization Advanced Analytics & Insights AI/ML Implementation Data Governance & Compliance Industry-specific Data Solutions",
        "Data Platform Modernization",
        "Advanced Analytics & Insights",
        "AI/ML Implementation",
        "Data Governance & Compliance",
        "Industry-specific Data Solutions",
        "Cloud & Platform Engineering Cloud Migration & Transformation Multi-cloud Strategy & Management Cloud Optimization & FinOps DevOps & Site Reliability Engineering Enterprise Security & Compliance",
        "Cloud Migration & Transformation",
        "Multi-cloud Strategy & Management",
        "Cloud Optimization & FinOps",
        "DevOps & Site Reliability Engineering",
        "Enterprise Security & Compliance",
        "Enterprise System Automation Robotic Process Automation Business Process Transformation API Management & System Integration Low-code/No-code Development Agentic Workflow Automation",
        "Robotic Process Automation",
        "Business Process Transformation",
        "API Management & System Integration",
        "Low-code/No-code Development",
        "Agentic Workflow Automation",
        "Agentic AI Offerings AI-Powered Legacy Modernization Intelligent SDLC Transformation GenAI Lab Agentic AI Solutions Agentic AI Services",
        "AI-Powered Legacy Modernization",
        "Intelligent SDLC Transformation",
        "GenAI Lab",
        "Agentic AI Solutions",
        "Agentic AI Services",
        "Agentic AI AI-Powered Legacy Modernization Intelligent SDLC Transformation GenAI Lab Agentic AI Solutions Agentic AI Services",
        "AI-Powered Legacy Modernization",
        "Intelligent SDLC Transformation",
        "GenAI Lab",
        "Agentic AI Solutions",
        "Agentic AI Services",
        "Industries Retail & E-Commerce Media & Entertainment FinTech/BFSI Healthcare Education Cybersecurity Social Impact Organizations Governance, Risk & Compliance (GRC) Energy & Utility Private Equity & Portfolio Companies",
        "Retail & E-Commerce",
        "Media & Entertainment",
        "FinTech/BFSI",
        "Healthcare",
        "Education",
        "Cybersecurity",
        "Social Impact Organizations",
        "Governance, Risk & Compliance (GRC)",
        "Energy & Utility",
        "Private Equity & Portfolio Companies",
        "Industries Retail & E-Commerce Media & Entertainment FinTech/BFSI Healthcare Education Cybersecurity Social Impact Organizations Governance, Risk & Compliance (GRC) Energy & Utility Private Equity & Portfolio Companies",
        "Retail & E-Commerce",
        "Media & Entertainment",
        "FinTech/BFSI",
        "Healthcare",
        "Education",
        "Cybersecurity",
        "Social Impact Organizations",
        "Governance, Risk & Compliance (GRC)",
        "Energy & Utility",
        "Private Equity & Portfolio Companies",
        "Innovations Our IP and Accelerators Innovation Summit Innovation Summit 2025 Innovation Summit 2024 Innovation Summit 2023 Innovation Summit 2022 Innovation Summit 2019 Innovation Summit 2018 Accion Labs Innovation Roundtable (AIR) Austin Pittsburgh",
        "Our IP and Accelerators",
        "Innovation Summit Innovation Summit 2025 Innovation Summit 2024 Innovation Summit 2023 Innovation Summit 2022 Innovation Summit 2019 Innovation Summit 2018",
        "Innovation Summit 2025",
        "Innovation Summit 2024",
        "Innovation Summit 2023",
        "Innovation Summit 2022",
        "Innovation Summit 2019",
        "Innovation Summit 2018",
        "Accion Labs Innovation Roundtable (AIR) Austin Pittsburgh",
        "Austin",
        "Pittsburgh",
        "Innovations Our IP and Accelerators Innovation Summit Innovation Summit 2025 Innovation Summit 2024 Innovation Summit 2023 Innovation Summit 2022 Innovation Summit 2019 Innovation Summit 2018 Accion Labs Innovation Roundtable (AIR) Austin Pittsburgh",
        "Our IP and Accelerators",
        "Innovation Summit Innovation Summit 2025 Innovation Summit 2024 Innovation Summit 2023 Innovation Summit 2022 Innovation Summit 2019 Innovation Summit 2018",
        "Innovation Summit 2025"
      ],
      "emails": [
        "hello@power.com"
      ],
      "phones": [
        "94-2096691",
        "123991924115",
        "17126392492355"
      ],
      "full_text": "Empowering Businesses Through Innovative Transformation | Accion Labs Skip to content Close Capabilities Digital Engineering Services SaaS Product Development Re-engineering & Modernization Product Portfolio Rationalization Digital Experience Enhancement Emerging Tech Solutioning Data & AI Services Data Platform Modernization Advanced Analytics & Insights AI/ML Implementation Data Governance & Compliance Industry-specific Data Solutions Cloud & Platform Engineering Cloud Migration & Transformation Multi-cloud Strategy & Management Cloud Optimization & FinOps DevOps & Site Reliability Engineering Enterprise Security & Compliance Enterprise System Automation Robotic Process Automation Business Process Transformation API Management & System Integration Low-code/No-code Development Agentic Workflow Automation Capabilities Digital Engineering Services SaaS Product Development Re-engineering & Modernization Product Portfolio Rationalization Digital Experience Enhancement Emerging Tech Solutioning Data & AI Services Data Platform Modernization Advanced Analytics & Insights AI/ML Implementation Data Governance & Compliance Industry-specific Data Solutions Cloud & Platform Engineering Cloud Migration & Transformation Multi-cloud Strategy & Management Cloud Optimization & FinOps DevOps & Site Reliability Engineering Enterprise Security & Compliance Enterprise System Automation Robotic Process Automation Business Process Transformation API Management & System Integration Low-code/No-code Development Agentic Workflow Automation Agentic AI Offerings AI-Powered Legacy Modernization Intelligent SDLC Transformation GenAI Lab Agentic AI Solutions Agentic AI Services Agentic AI AI-Powered Legacy Modernization Intelligent SDLC Transformation GenAI Lab Agentic AI Solutions Agentic AI Services Industries Retail & E-Commerce Media & Entertainment FinTech/BFSI Healthcare Education Cybersecurity Social Impact Organizations Governance, Risk & Compliance (GRC) Energy & Utility Private Equity & Portfolio Companies Industries Retail & E-Commerce Media & Entertainment FinTech/BFSI Healthcare Education Cybersecurity Social Impact Organizations Governance, Risk & Compliance (GRC) Energy & Utility Private Equity & Portfolio Companies Innovations Our IP and Accelerators Innovation Summit Innovation Summit 2025 Innovation Summit 2024 Innovation Summit 2023 Innovation Summit 2022 Innovation Summit 2019 Innovation Summit 2018 Accion Labs Innovation Roundtable (AIR) Austin Pittsburgh Innovations Our IP and Accelerators Innovation Summit Innovation Summit 2025 Innovation Summit 2024 Innovation Summit 2023 Innovation Summit 2022 Innovation Summit 2019 Innovation Summit 2018 Accion Labs Innovation Roundtable (AIR) Austin Pittsburgh Insights Success Stories Blogs News Webinars Podcasts Media Kit Videos Insights Success Stories Blogs News Webinar Podcasts Media Kit Videos Careers US Czech Republic Careers US Czech Republic About Leadership Board Values Tech Partners DEI Supplier Microsite About Leadership Board Values Tech Partners DEI Supplier Microsite SEARCH Contact Us Capabilities Digital Engineering Services SaaS Product Development Re-engineering & Modernization Product Portfolio Rationalization Digital Experience Enhancement Emerging Tech Solutioning Data & AI Services Data Platform Modernization Advanced Analytics & Insights AI/ML Implementation Data Governance & Compliance Industry-specific Data Solutions Cloud & Platform Engineering Cloud Migration & Transformation Multi-cloud Strategy & Management Cloud Optimization & FinOps DevOps & Site Reliability Engineering Enterprise Security & Compliance Enterprise System Automation Robotic Process Automation Business Process Transformation API Management & System Integration Low-code/No-code Development Agentic Workflow Automation Capabilities Digital Engineering Services SaaS Product Development Re-engineering & Modernization Product Portfolio Rationalization Digital Experience Enhancement Emerging Tech Solutioning Data & AI Services Data Platform Modernization Advanced Analytics & Insights AI/ML Implementation Data Governance & Compliance Industry-specific Data Solutions Cloud & Platform Engineering Cloud Migration & Transformation Multi-cloud Strategy & Management Cloud Optimization & FinOps DevOps & Site Reliability Engineering Enterprise Security & Compliance Enterprise System Automation Robotic Process Automation Business Process Transformation API Management & System Integration Low-code/No-code Development Agentic Workflow Automation Agentic AI Offerings AI-Powered Legacy Modernization Intelligent SDLC Transformation GenAI Lab Agentic AI Solutions Agentic AI Services Agentic AI AI-Powered Legacy Modernization Intelligent SDLC Transformation GenAI Lab Agentic AI Solutions Agentic AI Services Industries Retail & E-Commerce Media & Entertainment FinTech/BFSI Healthcare Education Cybersecurity Social Impact Organizations Governance, Risk & Compliance (GRC) Energy & Utility Private Equity & Portfolio Companies Industries Retail & E-Commerce Media & Entertainment FinTech/BFSI Healthcare Education Cybersecurity Social Impact Organizations Governance, Risk & Compliance (GRC) Energy & Utility Private Equity & Portfolio Companies Innovations Our IP and Accelerators Innovation Summit Innovation Summit 2025 Innovation Summit 2024 Innovation Summit 2023 Innovation Summit 2022 Innovation Summit 2019 Innovation Summit 2018 Accion Labs Innovation Roundtable (AIR) Austin Pittsburgh Innovations Our IP and Accelerators Innovation Summit Innovation Summit 2025 Innovation Summit 2024 Innovation Summit 2023 Innovation Summit 2022 Innovation Summit 2019 Innovation Summit 2018 Accion Labs Innovation Roundtable (AIR) Austin Pittsburgh Insights Success Stories Blogs News Webinars Podcasts Media Kit Videos Insights Success Stories Blogs News Webinar Podcasts Media Kit Videos Careers US Czech Republic Careers US Czech Republic About Leadership Board Values Tech Partners DEI Supplier Microsite About Leadership Board Values Tech Partners DEI Supplier Microsite Contact Us Accelerating Transformation in Healthcare Al-First, Platform-led Innovation Engineering Services Company Read More Accelerating Transformation in Healthcare Empowering GCCs to Accelerate Global Impact Know More Accelerating Transformation in Healthcare Impacting Lives By Transforming Businesses Through Innovations Contact Us Accelerating Transformation in Healthcare Accion Labs acquires NetServ to Strengthen Global Product Engineering Leadership Read More Accelerating Transformation in Healthcare Accion Labs Featured in Zinnov Zones for Digital Engineering and ER&D Services 2024 Across 18 Segments Learn More Accelerating Transformation in Healthcare Generative AI Unleashing the Potential of Advanced Language Comprehension Learn More Accelerating Transformation in Healthcare Data Analytics & Insights Building a Secure, Sustainable and Responsible Future Know More Accelerating Transformation in Healthcare Accion Labs Healthcare Unveils PBM NexaPro A Comprehensive PBM Services Unit Transforming Prescription Benefit Management Learn More Previous Next Al-First, Platform-led Innovation Engineering Services Company Read More Empowering GCCs to Accelerate Global Impact Know More Impacting Lives By Transforming Businesses Through Innovations Contact Us Accion Labs acquires NetServ to Strengthen Global Product Engineering Leadership Read More Accion Labs Featured in Zinnov Zones for Digital Engineering and ER&D Services 2024 Across 18 Segments Learn More Generative AI Unleashing the Potential of Advanced Language Comprehension Learn More Data Analytics & Insights Building a Secure, Sustainable and Responsible Future Know More Accion Labs Healthcare Unveils PBM NexaPro A Comprehensive PBM Services Unit Transforming Prescription Benefit Management Learn More Previous Next Accelerating Transformation in Healthcare Al-First, Platform-led Innovation Engineering Services Company Read More Accelerating Transformation in Healthcare Enhancing Lives By Transforming Businesses Through Innovation Contact Us Accelerating Transformation in Healthcare Accion Labs Featured in Zinnov Zones for Digital Engineering and ER&D Services 2024 Across 18 Segments Learn More Accelerating Transformation in Healthcare Generative AI Unleashing the Potential of Advanced Language Comprehension Learn More Accelerating Transformation in Healthcare Data Analytics & Insights Building a Secure, Sustainable and Responsible Future Know More Accelerating Transformation in Healthcare Accion Labs Healthcare Unveils PBM NexaPro A Comprehensive PBM Services Unit Transforming Prescription Benefit Management Learn More Accelerating Transformation in Healthcare Accion Labs Healthcare A Comprehensive PBM Services Unit Transforming Prescription Benefit Management Learn More Previous Next Al-First, Platform-led Innovation Engineering Services Company Read More Enhancing Lives By Transforming Businesses Through Innovation Contact Us Accion Labs Featured in Zinnov Zones for Digital Engineering and ER&D Services 2024 Across 18 Segments Learn More Generative AI Unleashing the Potential of Advanced Language Comprehension Learn More Data Analytics & Insights Building a Secure, Sustainable and Responsible Future Know More Accion Labs Healthcare Unveils PBM NexaPro A Comprehensive PBM Services Unit Transforming Prescription Benefit Management Learn More Accion Labs Healthcare A Comprehensive PBM Services Unit Transforming Prescription Benefit Management Learn More Previous Next Service Pillars Driving Innovation at Accion Labs Product Engineering Product Engineering Facilitating Digital Transformation journeys by crafting highly customized Digital Products that seamlessly cater to the unique requirements and allow end-to-end interactions throughout the product lifecycle. Read more Data Analytics & Insights Data Analytics & Insights Experience the full potential of our Data Services, where agility and data-driven expertise converge to shape customized solutions, elevate operations, and enrich experiences. Propel your transformation to a data-centric architecture by leveraging the strengths of IP accelerators on your journey with us. Read more Automation Automation Take a leap forward into our advanced Automation Services, where we assess, embrace, and seamlessly integrate Innovation. Discover increased efficiency and unparalleled operational excellence tailored to thrive in the dynamic and ever-evolving business landscape. Read more Cloud Cloud Explore our comprehensive Cloud Services, including expert cloud management and advanced cloud computing solutions, to elevate your business operations. Leverage our specialized cloud migration services to transition to a modern cloud infrastructure seamlessly. Read more Digital Engineering Digital Engineering Legacy systems slow release cycles and limit innovation. Our architecture-first modernization framework reduces tech debt and accelerates product launches by 30%–50% through AI-integrated SDLC practices. From modernizing legacy platforms to building SaaS products or adding automation, we bring domain-aligned architecture and engineering depth for high-performing systems. Read More Data and AI Data and AI Siloed data and opaque models create blind spots for decision-makers. We help enterprises unify fragmented data, enforce governance frameworks, and meet regulatory requirements through traceable pipelines and explainable AI. From AI-powered analytics to NLP workflows, our solutions enhance forecast accuracy, reduce compliance exposure, and shorten decision cycles. Read More Cloud & Platform Engineering Cloud & Platform Engineering Unstructured cloud adoption often increases cost and complexity. We design cloud-native architectures using infrastructure-as-code, strong security frameworks, and automated policy enforcement. From cloud migration to hybrid orchestration, we help enterprises reduce cloud costs by 15%–30%, speed up deployments, and ensure compliance. Read More Enterprise System Automation Enterprise System Automation Fragmented workflows and manual tasks limit operational efficiency. We go beyond traditional RPA with automation frameworks that integrate business rules, support dynamic coordination, and work across legacy and modern systems. Our approach enables faster execution, policy enforcement, and real-time visibility at scale. Read More Agentic AI Solutions Agentic AI Solutions Traditional automation struggles with tasks needing real-time adaptability. Our agentic systems, powered by BizBrain AI, KAPS, and GenAI in a Box, manage multi-step tasks with human oversight, audit trails, and compliance. These AI agents support use cases in support, development, and operations, helping enterprises move from reactive automation to intelligent autonomy. Read More 0 + Global Team 0 + Success Stories 0 + Technology Accelerators 0 Locations 0 + Global Team Members 0 + Proprietary IPs Developed 0 + GenAI Implementations Delivered 0 Global Delivery Locations 0 + Centers of Excellence Driving Innovation 0 + Employees 0 + AI-trained Engineers 0 Proprietary Platforms 0 + AI/GenAI Implementations 0 + Success Stories 0 + Technology Accelerators 0 Global Locations Redefining Innovation Across Industries Explore our industry-specific solutions designed to address the unique challenges of your business and drive growth. Governance, Risk & Compliance (GRC) Read More Healthcare & Life Sciences Read More Media, Entertainment & Telecom Read More Retail & CPG Read More /social-impact-consulting Read More Energy & Utility Read More Technology Read More FinTech/BFSI Read More Redefining Innovation Across Industries Our work spans mission-critical environments, where uptime, compliance, and product integrity matter. Every engagement is shaped by domain-specific experience and technical precision. Hi-Tech BFSI Healthcare & Life Sciences Consumer, Media & Retail Manufacturing Education Energy Specialized Micro-verticals Tech leaders face pressure to innovate quickly while maintaining platform stability. We help product-first organizations reduce development cycles by up to 50% and improve release predictability through domain-specific architecture, AI adoption, and scalable engineering models across SaaS platforms, developer tools, and middleware. Explore Our Hi-Tech Engineering Solutions Financial institutions must align digital strategy with audit-readiness and risk management. We implement AI for fraud detection, automate policy enforcement, and modernize transaction systems while supporting compliance with frameworks like SOC 2, PCI DSS, and GDPR. Our solutions reduce fraud investigation time by 40% and enable real-time decision support. Explore Our BFSI-Specific Engineering Solutions Patient care and data privacy go hand in hand. We build HIPAA-ready platforms such as EMR-integrated front doors (patient portal solutions that unify scheduling, communication, and care coordination), pharmacy benefit management platforms, and clinical analytics engines that unify scheduling, communication, and care coordination. Our deployments prioritize traceability, access control, and interoperability. Explore Our Healthcare Service Solutions Consumer-facing brands must adapt in real time to shifting behavior, inventory signals, and pricing logic. Our commerce platforms improve conversion rates by 15%–25% and ensure consistent experiences across channels. From omnichannel personalization to AI-enabled promotions, we drive measurable lift without compromising operations. Explore Our Media & Customer Engagement Solutions Manufacturers need reliability, traceability, and real-time coordination across supply chains and plants. We build fault-tolerant systems integrating IoT monitoring, AI-based demand forecasting, and agentic automation. Our platforms are designed to meet the performance, and compliance demands of high-stakes manufacturing environments. Explore Our Manufacturing System Solutions Edtech and educational institutions need personalized learning experiences that comply with data privacy norms. We build adaptive learning systems, AI-driven engagement layers, and scalable digital infrastructure that supports real-time insights, accessibility, and student success across hybrid formats. Explore Our EdTech Engineering Solutions Grid operators and energy providers demand high availability and regulatory compliance. We build platforms that capture field telemetry, enforce grid integrity, and automate response planning. Our AI-powered systems reduce downtime, support predictive maintenance, and align with evolving energy regulations. Explore Our Energy Systems Engineering Solutions We deliver purpose-built platforms for pharmacy benefit management (PBM), global impact organizations, digital healthcare front doors (patient portal solutions that unify scheduling, communication, and care coordination), and enterprise security vendors . Our solutions embed domain-specific rules, compliance checkpoints, and automation logic to support high-risk, high-impact environments. Every implementation aligns with regulatory expectations and operational constraints without sacrificing speed or visibility. Explore Our Domain-specific Engineering Solutions Hi-Tech BFSI Healthcare & Life Sciences Consumer, Media & Retail Manufacturing Education Energy Specialized Micro-verticals Tech leaders face pressure to innovate quickly while maintaining platform stability. We help product-first organizations reduce development cycles by up to 50% and improve release predictability through domain-specific architecture, AI adoption, and scalable engineering models across SaaS platforms, developer tools, and middleware. Explore Our Hi-Tech Engineering Solutions Financial institutions must align digital strategy with audit-readiness and risk management. We implement AI for fraud detection, automate policy enforcement, and modernize transaction systems while supporting compliance with frameworks like SOC 2, PCI DSS, and GDPR. Our solutions reduce fraud investigation time by 40% and enable real-time decision support. Explore Our BFSI-Specific Engineering Solutions Patient care and data privacy go hand in hand. We build HIPAA-ready platforms such as EMR-integrated front doors (patient portal solutions that unify scheduling, communication, and care coordination), pharmacy benefit management platforms, and clinical analytics engines that unify scheduling, communication, and care coordination. Our deployments prioritize traceability, access control, and interoperability. Explore Our Healthcare Service Solutions Consumer-facing brands must adapt in real time to shifting behavior, inventory signals, and pricing logic. Our commerce platforms improve conversion rates by 15%–25% and ensure consistent experiences across channels. From omnichannel personalization to AI-enabled promotions, we drive measurable lift without compromising operations. Explore Our Media & Customer Engagement Solutions Manufacturers need reliability, traceability, and real-time coordination across supply chains and plants. We build fault-tolerant systems integrating IoT monitoring, AI-based demand forecasting, and agentic automation. Our platforms are designed to meet the performance, and compliance demands of high-stakes manufacturing environments. Explore Our Manufacturing System Solutions Edtech and educational institutions need personalized learning experiences that comply with data privacy norms. We build adaptive learning systems, AI-driven engagement layers, and scalable digital infrastructure that supports real-time insights, accessibility, and student success across hybrid formats. Explore Our EdTech Engineering Solutions Grid operators and energy providers demand high availability and regulatory compliance. We build platforms that capture field telemetry, enforce grid integrity, and automate response planning. Our AI-powered systems reduce downtime, support predicti"
    }
  ]
}