{
  "took_seconds": 7.27,
  "count": 10,
  "results": [
    {
      "url": "https://hungarianai.com",
      "domain": "hungarianai.com",
      "scraped_at": "2026-02-08T12:35:26.055910",
      "error": "HTTPSConnectionPool(host='hungarianai.com', port=443): Max retries exceeded with url: / (Caused by NameResolutionError(\"HTTPSConnection(host='hungarianai.com', port=443): Failed to resolve 'hungarianai.com' ([Errno 11001] getaddrinfo failed)\"))"
    },
    {
      "url": "https://aiharmony.io",
      "domain": "aiharmony.io",
      "scraped_at": "2026-02-08T12:35:26.051564",
      "title": null,
      "meta_description": null,
      "headings": {
        "h1": [],
        "h2": [],
        "h3": []
      },
      "paragraphs": [],
      "list_items": [],
      "emails": [],
      "phones": [],
      "full_text": ""
    },
    {
      "url": "https://bharti.ai",
      "domain": "bharti.ai",
      "scraped_at": "2026-02-08T12:35:26.059568",
      "title": null,
      "meta_description": null,
      "headings": {
        "h1": [],
        "h2": [],
        "h3": []
      },
      "paragraphs": [],
      "list_items": [],
      "emails": [],
      "phones": [],
      "full_text": ""
    },
    {
      "url": "https://harrison.ai",
      "domain": "harrison.ai",
      "scraped_at": "2026-02-08T12:35:26.053710",
      "title": "Harrison.ai | Medical imaging AI tools",
      "meta_description": "Reimagining the future of healthcare with AI Get started Trusted by leading public and private healthcare providers around the world. Raising the standard of care. We’re empowering clinicians with next-generation",
      "headings": {
        "h1": [
          "Reimagining the future of healthcare with AI",
          "Raising the standard of care. We’re empowering clinicians with next-generation medical imaging AI tools, so that no patient’s outcome hinges on the capacity limits of the healthcare system. 3,500 clinicians at over 1,000 sites across four continents are using our AI solutions as assistive tools to diagnose and treat patients faster, and raise the standard of care for patients."
        ],
        "h2": [
          "Trusted by leading public and private healthcare providers globally.",
          "Unlock clinical and operational benefits across the clinical workflow with award-winning Al tools.",
          "Supporting faster time to diagnosis and treatment.",
          "Catch more. Miss less.",
          "Improve efficiency and productivity.",
          "Discover our award-winning radiology solutions.",
          "Accelerate cancer care. Find the urgent needle in the non-urgent haystack. Explore use cases.",
          "Emergency and acute care",
          "Public hospitals",
          "Oncology management",
          "Private hospitals",
          "Teleradiology",
          "Incidental detection",
          "Chronic disease management",
          "Announcement: The latest frontier in radiology-specific foundational models is now publicly available for research use.",
          "Discover how leading healthcare providers drive better patient care.",
          "Of all CXRs in NHS England now processed with Harrison CXR.",
          "Of public Accident & Emergency departments in Hong Kong now use Harrison.ai.",
          "In funding, backed by leading global investors.",
          "Countries have clearance for clinical use of Harrison.ai solutions.",
          "Of radiologists in Australia now have access to Harrison CXR.",
          "Hospitals in UK across 45+ NHS Trusts now use Harrison.ai.",
          "Of all CXRs in NHS England now processed with Harrison CXR.",
          "Of public Accident & Emergency departments in Hong Kong now use Harrison.ai.",
          "In funding, backed by leading global investors.",
          "Countries have clearance for clinical use of Harrison.ai solutions.",
          "Of radiologists in Australia now have access to Harrison CXR.",
          "Hospitals in UK across 45+ NHS Trusts now use Harrison.ai."
        ],
        "h3": []
      },
      "paragraphs": [
        "Book a demo at ECR 2026. Book Now →",
        "We’re empowering clinicians with next-generation medical imaging AI tools, so that no patient’s outcome hinges on the capacity limits of the healthcare system.",
        "3,500 clinicians at over 1,000 sites across four continents are using our AI solutions as assistive tools to diagnose and treat patients faster, and raise the standard of care for patients.",
        "A comprehensive decision-support AI solution for non-contrast head CT studies, that detects up to 130 findings in under 90 seconds.",
        "A comprehensive decision-support AI solution for chest X-rays, that detects up to 124 findings in under 20 seconds.",
        "A comprehensive decision-support solution for chest CT, that detects up to 167 radiological features.",
        "1,000+ sites across four continents use our AI solutions.",
        "Disclaimer: The information on this website is intended exclusively for the use of healthcare professionals. The products displayed on this website are not available for purchase by the general public and are intended for professional use only.",
        "\" * \" indicates required fields",
        "View our Privacy Notice to learn how we manage your personal information.",
        "You are about to visit our Global website. Please note, product availability, regulatory status, and medical indications vary by country, and some items may not be authorised for use in your region.",
        "How can we direct you?"
      ],
      "list_items": [
        "Products Radiology Solutions CT Brain Chest X-ray CT Chest",
        "Radiology Solutions CT Brain Chest X-ray CT Chest",
        "CT Brain",
        "Chest X-ray",
        "CT Chest",
        "Solutions by organisation Public Hospital Private Hospital Private Radiology Provider by use case Oncology Management Emergency and Acute Care",
        "by organisation Public Hospital Private Hospital Private Radiology Provider",
        "Public Hospital",
        "Private Hospital",
        "Private Radiology Provider",
        "by use case Oncology Management Emergency and Acute Care",
        "Oncology Management",
        "Emergency and Acute Care",
        "Resources Case Studies Evidence Podcast Webinars Guides Blogs Radiology Foundation Model",
        "Case Studies",
        "Evidence",
        "Podcast",
        "Webinars",
        "Guides",
        "Radiology Foundation Model",
        "Company About Us Life at Harrison.ai Careers Newsroom",
        "About Us",
        "Life at Harrison.ai",
        "Careers",
        "Newsroom",
        "Contact",
        "Australia",
        "Global",
        "Quickly identify patients ‘flagged’ in the worklist for prioritised diagnostic and treatment pathways.",
        "Improve diagnostic accuracy with clinical decision-support AI tools, providing clinicians with a second pair of eyes for subtle and complex cases.",
        "Leverage AI features for faster radiology turnaround times and more efficient radiology workflows.",
        "HARRISON.AI CT BRAIN",
        "HARRISON.AI CHEST X-RAY",
        "HARRISON.AI CT CHEST",
        "Radiology Solutions Chest X-ray CT Brain CT Chest",
        "Chest X-ray",
        "CT Brain",
        "CT Chest",
        "Pathology solutions Prostate",
        "Prostate",
        "by organisation Public Hospital Private Hospital Private Radiology Provider",
        "Public Hospital",
        "Private Hospital",
        "Private Radiology Provider",
        "by use case Oncology Management Emergency and Acute Care",
        "Oncology Management",
        "Emergency and Acute Care",
        "Resources Case Studies Evidence Podcast Blogs Radiology Foundation Model",
        "Case Studies",
        "Evidence",
        "Podcast",
        "Radiology Foundation Model",
        "Company About us Life at Harrison.ai Careers Newsroom",
        "About us",
        "Life at Harrison.ai",
        "Careers",
        "Newsroom",
        "Contact us Level P 24 Campbell St Sydney NSW 2000 Australia Customer Support",
        "Level P 24 Campbell St Sydney NSW 2000 Australia",
        "Customer Support",
        "Privacy",
        "Terms of Use",
        "Modern Slavery Policy",
        "Carbon Reduction Plan"
      ],
      "emails": [
        "1-80-findings@2x-1-768x697.jpg",
        "1-80-findings@2x-1-1024x929.jpg",
        "support@harrison.ai",
        "1-80-findings@2x-1-460x417.jpg",
        "1-80-findings@2x-1.jpg"
      ],
      "phones": [
        "1767747692621",
        "292893 0",
        "105357 4"
      ],
      "full_text": "Harrison.ai | Medical imaging AI tools Skip to content Javascript must be enabled for the correct page display Unlocking infinite medical capacity. Book a demo at ECR 2026. Book Now → Products Radiology Solutions CT Brain Chest X-ray CT Chest Solutions by organisation Public Hospital Private Hospital Private Radiology Provider by use case Oncology Management Emergency and Acute Care Resources Case Studies Evidence Podcast Webinars Guides Blogs Radiology Foundation Model Company About Us Life at Harrison.ai Careers Newsroom Contact Australia Global USA Book a demo Reimagining the future of healthcare with AI Get started Trusted by leading public and private healthcare providers globally. Raising the standard of care. We’re empowering clinicians with next-generation medical imaging AI tools, so that no patient’s outcome hinges on the capacity limits of the healthcare system. 3,500 clinicians at over 1,000 sites across four continents are using our AI solutions as assistive tools to diagnose and treat patients faster, and raise the standard of care for patients. Unlock clinical and operational benefits across the clinical workflow with award-winning Al tools. Supporting faster time to diagnosis and treatment. Quickly identify patients ‘flagged’ in the worklist for prioritised diagnostic and treatment pathways. Catch more. Miss less. Improve diagnostic accuracy with clinical decision-support AI tools, providing clinicians with a second pair of eyes for subtle and complex cases. Improve efficiency and productivity. Leverage AI features for faster radiology turnaround times and more efficient radiology workflows. Discover our award-winning radiology solutions. HARRISON.AI CT BRAIN HARRISON.AI CHEST X-RAY HARRISON.AI CT CHEST HARRISON.AI CT BRAIN A comprehensive decision-support AI solution for non-contrast head CT studies, that detects up to 130 findings in under 90 seconds. Explore the products Product images are stylised; may differ slightly from actual product UI. HARRISON.AI CHEST X-RAY A comprehensive decision-support AI solution for chest X-rays, that detects up to 124 findings in under 20 seconds. Explore the products Product images are stylised; may differ slightly from actual product UI. HARRISON.AI CT CHEST A comprehensive decision-support solution for chest CT, that detects up to 167 radiological features. Discover CT Chest Product images are stylised; may differ slightly from actual product UI. Not all features are available in all regions. Accelerate cancer care. Find the urgent needle in the non-urgent haystack. Explore use cases. Emergency and acute care Find out more Public hospitals Find out more Oncology management Find out more Private hospitals Find out more Teleradiology Find out more Incidental detection Chronic disease management “The adoption of AI holds immense promise for revolutionising the way we deliver healthcare services to our patients. It not only enhances efficiency but also elevates diagnostic accuracy to unprecedented levels.” Dr. Seow Vei Ken Chief Executive Officer “Harrison.ai Chest X-ray provides a critical safeguard, ensuring no detail is overlooked in our mission to save lives.” Dr. Siavash Es’haghi, Director and Radiologist “It is ultimately helping us diagnose issues at the very earliest opportunity and provide earlier treatment and improved health outcomes.” Clare Butt Advanced Practitioner in Radiology “We can analyse CT brain scans with exceptional accuracy, identifying potential abnormalities and highlighting them to radiologists within 10 minutes. This rapid turnaround time is a game-changer for patients with urgent medical needs.” Dr. Arun Kumar Govindarajan Executive Director & Radiologist “We’re confident that this solution leads in its category for its comprehensive capabilities.” Dr. Julian Adler CEO “This technology will enhance diagnostic accuracy, and efficiency, ultimately revolutionising patient care.” Dr Phil Lucas Lumus Imaging Group Executive Announcement: The latest frontier in radiology-specific foundational models is now publicly available for research use. Access now Discover how leading healthcare providers drive better patient care. 1,000+ sites across four continents use our AI solutions. >35% Of all CXRs in NHS England now processed with Harrison CXR. 100% Of public Accident & Emergency departments in Hong Kong now use Harrison.ai. $240M In funding, backed by leading global investors. 40+ Countries have clearance for clinical use of Harrison.ai solutions. +50% Of radiologists in Australia now have access to Harrison CXR. >130 Hospitals in UK across 45+ NHS Trusts now use Harrison.ai. >35% Of all CXRs in NHS England now processed with Harrison CXR. 100% Of public Accident & Emergency departments in Hong Kong now use Harrison.ai. $240M In funding, backed by leading global investors. 40+ Countries have clearance for clinical use of Harrison.ai solutions. +50% Of radiologists in Australia now have access to Harrison CXR. 130 Hospitals in UK across 45+ NHS Trusts now use Harrison.ai. Book a demo. Disclaimer: The information on this website is intended exclusively for the use of healthcare professionals. The products displayed on this website are not available for purchase by the general public and are intended for professional use only. Book a demo products Radiology Solutions Chest X-ray CT Brain CT Chest Pathology solutions Prostate Solutions by organisation Public Hospital Private Hospital Private Radiology Provider by use case Oncology Management Emergency and Acute Care Resources Case Studies Evidence Podcast Blogs Radiology Foundation Model Company About us Life at Harrison.ai Careers Newsroom Contact us Level P 24 Campbell St Sydney NSW 2000 Australia Customer Support Privacy Terms of Use Modern Slavery Policy Carbon Reduction Plan Book a demo. \" * \" indicates required fields X/Twitter This field is for validation purposes and should be left unchanged. First name/s * Last name * Email * Country * Select Country Afghanistan Albania Algeria American Samoa Andorra Angola Anguilla Antarctica Antigua and Barbuda Argentina Armenia Aruba Australia Austria Azerbaijan Bahamas Bahrain Bangladesh Barbados Belarus Belgium Belize Benin Bermuda Bhutan Bolivia Bonaire, Sint Eustatius and Saba Bosnia and Herzegovina Botswana Bouvet Island Brazil British Indian Ocean Territory Brunei Darussalam Bulgaria Burkina Faso Burundi Cabo Verde Cambodia Cameroon Canada Cayman Islands Central African Republic Chad Chile China Christmas Island Cocos Islands Colombia Comoros Congo Congo, Democratic Republic of the Cook Islands Costa Rica Croatia Cuba Curaçao Cyprus Czechia Côte d'Ivoire Denmark Djibouti Dominica Dominican Republic Ecuador Egypt El Salvador Equatorial Guinea Eritrea Estonia Eswatini Ethiopia Falkland Islands Faroe Islands Fiji Finland France French Guiana French Polynesia French Southern Territories Gabon Gambia Georgia Germany Ghana Gibraltar Greece Greenland Grenada Guadeloupe Guam Guatemala Guernsey Guinea Guinea-Bissau Guyana Haiti Heard Island and McDonald Islands Holy See Honduras Hong Kong Hungary Iceland India Indonesia Iran Iraq Ireland Isle of Man Israel Italy Jamaica Japan Jersey Jordan Kazakhstan Kenya Kiribati Korea, Democratic People's Republic of Korea, Republic of Kuwait Kyrgyzstan Lao People's Democratic Republic Latvia Lebanon Lesotho Liberia Libya Liechtenstein Lithuania Luxembourg Macao Madagascar Malawi Malaysia Maldives Mali Malta Marshall Islands Martinique Mauritania Mauritius Mayotte Mexico Micronesia Moldova Monaco Mongolia Montenegro Montserrat Morocco Mozambique Myanmar Namibia Nauru Nepal Netherlands New Caledonia New Zealand Nicaragua Niger Nigeria Niue Norfolk Island North Macedonia Northern Mariana Islands Norway Oman Pakistan Palau Palestine, State of Panama Papua New Guinea Paraguay Peru Philippines Pitcairn Poland Portugal Puerto Rico Qatar Romania Russian Federation Rwanda Réunion Saint Barthélemy Saint Helena, Ascension and Tristan da Cunha Saint Kitts and Nevis Saint Lucia Saint Martin Saint Pierre and Miquelon Saint Vincent and the Grenadines Samoa San Marino Sao Tome and Principe Saudi Arabia Senegal Serbia Seychelles Sierra Leone Singapore Sint Maarten Slovakia Slovenia Solomon Islands Somalia South Africa South Georgia and the South Sandwich Islands South Sudan Spain Sri Lanka Sudan Suriname Svalbard and Jan Mayen Sweden Switzerland Syria Arab Republic Taiwan Tajikistan Tanzania, the United Republic of Thailand Timor-Leste Togo Tokelau Tonga Trinidad and Tobago Tunisia Turkmenistan Turks and Caicos Islands Tuvalu Türkiye US Minor Outlying Islands Uganda Ukraine United Arab Emirates United Kingdom United States Uruguay Uzbekistan Vanuatu Venezuela Viet Nam Virgin Islands, British Virgin Islands, U.S. Wallis and Futuna Western Sahara Yemen Zambia Zimbabwe Åland Islands Country Organisation * Message * Consent I'd like to receive webinar invitations, clinical updates and news from Harrison. Submit View our Privacy Notice to learn how we manage your personal information. You are about to visit our Global website. Please note, product availability, regulatory status, and medical indications vary by country, and some items may not be authorised for use in your region. Continue How can we direct you? Public hospital Private hospital Private radiology provider"
    },
    {
      "url": "https://gravity.ai",
      "domain": "gravity.ai",
      "scraped_at": "2026-02-08T12:35:26.808546",
      "title": "Gravity AI",
      "meta_description": null,
      "headings": {
        "h1": [
          "Your intelligent assistant, purpose-built to enhance and streamline your experience with Gravity"
        ],
        "h2": [],
        "h3": []
      },
      "paragraphs": [
        "© 2025 · Rocketgenius"
      ],
      "list_items": [],
      "emails": [],
      "phones": [
        "181) 100",
        "240) 100",
        "130) 100"
      ],
      "full_text": "Gravity AI Your intelligent assistant, purpose-built to enhance and streamline your experience with Gravity Terms of Use Privacy Policy Get Gravity Forms © 2025 · Rocketgenius"
    },
    {
      "url": "https://nng.ai",
      "domain": "nng.ai",
      "scraped_at": "2026-02-08T12:35:26.864179",
      "error": "HTTPSConnectionPool(host='nng.ai', port=443): Max retries exceeded with url: / (Caused by SSLError(SSLCertVerificationError(1, \"[SSL: CERTIFICATE_VERIFY_FAILED] certificate verify failed: Hostname mismatch, certificate is not valid for 'nng.ai'. (_ssl.c:1000)\")))"
    },
    {
      "url": "https://aimotive.com",
      "domain": "aimotive.com",
      "scraped_at": "2026-02-08T12:35:26.074186",
      "title": "Automated Driving Tooling and Embedded Solutions - aiMotive",
      "meta_description": "With our tools and solutions, automotive partners accelerate development, cut costs, and lead in ADAS and automated driving innovation.",
      "headings": {
        "h1": [
          "News & insights",
          "We enable OEMs to deliver scalable solutions from concept to production – faster, better,  and more efficiently",
          "Our holistic approach",
          "Our holistic approach",
          "Check out our latest stories",
          "Join our newsletter"
        ],
        "h2": [
          "Automated Driving Tooling and Embedded Solutions",
          "aiMotive Unveils aiSim 5",
          "l4 experience in silicon valley",
          "aiSim",
          "aiData",
          "aiWare 5",
          "Stellantis development",
          "Market-ready",
          "Open ecosystem",
          "Asset Publisher",
          "Scalable Automated Driving and Next-Generation Simulation at CES 2026",
          "aiMotive and LG to unveil advanced integrated IVI/ADAS controller at CES 2026",
          "AI-powered Data Virtualization Comes to Japan",
          "Join our newsletter",
          "Contact With Us",
          "Follow Us On Social",
          "Offices",
          "Hungary",
          "USA",
          "Japan",
          "Latest News",
          "Asset Publisher",
          "Scalable Automated Driving and Next-Generation Simulation at CES 2026",
          "aiMotive and LG to unveil advanced integrated IVI/ADAS controller at CES 2026",
          "AI-powered Data Virtualization Comes to Japan",
          "Quick Links",
          "Contact With Us",
          "Follow Us On Social",
          "Offices",
          "Hungary",
          "Germany",
          "USA",
          "Japan",
          "Latest News",
          "Asset Publisher",
          "Scalable Automated Driving and Next-Generation Simulation at CES 2026",
          "aiMotive and LG to unveil advanced integrated IVI/ADAS controller at CES 2026",
          "AI-powered Data Virtualization Comes to Japan",
          "Quick Links"
        ],
        "h3": []
      },
      "paragraphs": [
        "Pioneering Next-Gen AutoGI for ADAS/AD Simulation",
        "L2 to L4 ADAS and automated driving features utilizing only radar and cameras without the need for an HD map.",
        "The latest generation of our simulation tool with flexible neural simulation and advanced lighting simulation capabilities.",
        "Fully automated data pipeline to accelerate the development of ADAS/AD features",
        "Our most powerful automotive NPU yet. Now with bit-accurate, faster-than-real-time cloud emulation for scalable ADAS CI/CD testing.",
        "With our tooling and embedded solutions, our automotive partners can accelerate their development time and reduce costs so they can become leaders in ADAS and AD-related experience. Our vision has not changed since our foundation: we would like to enable everyone to enjoy the benefits of automated driving.",
        "aiMotive technology supercharges Stellantis' mid-term development of STLA AutoDrive, the company’s autonomous driving tech platform",
        "Successfully closed evaluation projects with 5+ customers, including OEMs and Tier1s – first production programs underway",
        "A deep understanding of the synergies between HW and SW makes our portfolio scalable and unique in the automotive industry",
        "Since day one, we have looked at driving automation as a complex problem and worked on a holistic solution, instead of specializing in one isolated area. This holistic approach tackles both the tooling and the embedded solutions challenges of automated driving. Our expertise is in the combination of these pillars, making autonomous driving a reality. aiMotive's market-ready products enable our partners to quickly deploy affordable advanced ADAS and automated driving solutions.",
        "Enthusiastic colleagues",
        "Million scenarios run",
        "Total funding (million USD)",
        "Successful partner projects",
        "Since day one, we have looked at driving automation as a complex problem and worked on a holistic solution, instead of specializing in one isolated area. This holistic approach tackles both the tooling and the embedded solutions challenges of automated driving. Our expertise is in the combination of these pillars, making autonomous driving a reality. aiMotive's market-ready products enable our partners to quickly deploy affordable advanced ADAS and AD solutions.",
        "News, blogposts & more about aiMotive",
        "Introducing the world’s first real-time, hyper-realistic neural simulation enabled by aiSim connected to LGE’s HPC running aiMotive’s aiDrive automated driving software in a closed-loop.",
        "aiMotive, a leading developer of advanced artificial intelligence and automated driving software, in collaboration with LG, will introduce a next-generation High-Performing Computing (HPC) Lite platform at CES 2026.",
        "aiMotive, a leading provider of advanced automotive AI technologies, has partnered with its Japanese distributor, Macnica, to introduce a new data collection & processing environment powered by the aiData Platform.",
        "Sign up to our LinkedIn newsletter and get our latest news and updates.",
        "Sign up to our newsletter and get our latest news and updates.",
        "Your personal details are safe with us.",
        "Budapest Office Szépvölgyi út 18-22 1025 Budapest, Hungary",
        "Mountain View Office 1907 Colony Street Mountain View / CA, 94043",
        "Yokohama Office #501 Expert Office Shinyokohama, 3-7-18 Shinyokohama, Kohoku-ku, Yokohama, Kanagawa 222-0033 日本語での連絡はこちら [email protected]",
        "©2015–2026 aiMotive. All rights reserved.",
        "©2015–2026 aiMotive. All rights reserved."
      ],
      "list_items": [
        "Products aiDrive aiData aiSim aiWare",
        "aiDrive",
        "aiData",
        "aiWare",
        "Professional Services",
        "Partners & Clients",
        "Company About us Career News & insights",
        "About us",
        "Career",
        "News & insights",
        "Contact Us",
        "Providing embedded solutions and tooling For faster, better and cost-efficient AD solutions Get Started",
        "In-house developed tools To create and validate AD software solutions Get Started",
        "&imagePreview=1 The most efficient embedded solutions Ensuring highest efficiency at the lowest cost Get Started",
        "Linkedin",
        "Twitter",
        "Facebook",
        "Hungary Budapest Office Szépvölgyi út 18-22 1025 Budapest, Hungary",
        "USA Mountain View Office 1907 Colony Street Mountain View / CA, 94043",
        "Japan Yokohama Office #501 Expert Office Shinyokohama, 3-7-18 Shinyokohama, Kohoku-ku, Yokohama, Kanagawa 222-0033 日本語での連絡はこちら [email protected]",
        "Scalable Automated Driving and Next-Generation Simulation at CES 2026 7 January 2026",
        "aiMotive and LG to unveil advanced integrated IVI/ADAS controller at CES 2026 18 December 2025",
        "AI-powered Data Virtualization Comes to Japan 11 December 2025",
        "Data policies & Cookie consent",
        "Test schedule",
        "Open positions",
        "Contact us",
        "Financed project",
        "IMS Policy – ISO",
        "Annual energy report",
        "Whistleblowing Hotline",
        "Stellantis Code of Conduct",
        "Stellantis Conflict of Interest",
        "Linkedin",
        "Twitter",
        "Facebook",
        "Hungary Budapest Office Szépvölgyi út 18-22 1025 Budapest, Hungary",
        "Germany Munich Office Wilhelmine-Reichard-Straße 7, 80935 München, Germany",
        "USA Mountain View Office 1907 Colony Street Mountain View / CA, 94043",
        "Japan Yokohama Office Shinyokohama UU Building 8F 2-5-2 Shinyokohama Kohoku-ku, Yokohama Kanagawa 222-0033 日本語でのお問い合わせはこちらへ [email protected]",
        "Scalable Automated Driving and Next-Generation Simulation at CES 2026 7 January 2026",
        "aiMotive and LG to unveil advanced integrated IVI/ADAS controller at CES 2026 18 December 2025",
        "AI-powered Data Virtualization Comes to Japan 11 December 2025",
        "Data policies & Cookie consent",
        "Media gallery",
        "Test Schedule",
        "Open positions",
        "Contact us",
        "Financed projects",
        "ISP – 27001",
        "Annual energy report"
      ],
      "emails": [],
      "phones": [
        "1706137080000",
        "222-0033",
        "158-241905"
      ],
      "full_text": "Automated Driving Tooling and Embedded Solutions - aiMotive Skip to Main Content Products aiDrive aiData aiSim aiWare Professional Services Partners & Clients Company About us Career News & insights Contact Us JP Automated Driving Tooling and Embedded Solutions Providing embedded solutions and tooling For faster, better and cost-efficient AD solutions Get Started In-house developed tools To create and validate AD software solutions Get Started &imagePreview=1 The most efficient embedded solutions Ensuring highest efficiency at the lowest cost Get Started aiMotive technologies News & insights aiMotive Unveils aiSim 5 Pioneering Next-Gen AutoGI for ADAS/AD Simulation l4 experience in silicon valley L2 to L4 ADAS and automated driving features utilizing only radar and cameras without the need for an HD map. aiSim The latest generation of our simulation tool with flexible neural simulation and advanced lighting simulation capabilities. aiData Fully automated data pipeline to accelerate the development of ADAS/AD features aiWare 5 Our most powerful automotive NPU yet. Now with bit-accurate, faster-than-real-time cloud emulation for scalable ADAS CI/CD testing. aiMotive's Mission & Vision We enable OEMs to deliver scalable solutions from concept to production – faster, better, and more efficiently With our tooling and embedded solutions, our automotive partners can accelerate their development time and reduce costs so they can become leaders in ADAS and AD-related experience. Our vision has not changed since our foundation: we would like to enable everyone to enjoy the benefits of automated driving. Stellantis development aiMotive technology supercharges Stellantis' mid-term development of STLA AutoDrive, the company’s autonomous driving tech platform Market-ready Successfully closed evaluation projects with 5+ customers, including OEMs and Tier1s – first production programs underway Open ecosystem A deep understanding of the synergies between HW and SW makes our portfolio scalable and unique in the automotive industry Our technology What we do Our holistic approach Since day one, we have looked at driving automation as a complex problem and worked on a holistic solution, instead of specializing in one isolated area. This holistic approach tackles both the tooling and the embedded solutions challenges of automated driving. Our expertise is in the combination of these pillars, making autonomous driving a reality. aiMotive's market-ready products enable our partners to quickly deploy affordable advanced ADAS and automated driving solutions. Read more about our products 230+ Enthusiastic colleagues 5.5 Million scenarios run 73 Total funding (million USD) 30+ Successful partner projects What we do Our holistic approach Since day one, we have looked at driving automation as a complex problem and worked on a holistic solution, instead of specializing in one isolated area. This holistic approach tackles both the tooling and the embedded solutions challenges of automated driving. Our expertise is in the combination of these pillars, making autonomous driving a reality. aiMotive's market-ready products enable our partners to quickly deploy affordable advanced ADAS and AD solutions. Read more about our products Check out our latest stories News, blogposts & more about aiMotive Asset Publisher 7 January 2026 Scalable Automated Driving and Next-Generation Simulation at CES 2026 Introducing the world’s first real-time, hyper-realistic neural simulation enabled by aiSim connected to LGE’s HPC running aiMotive’s aiDrive automated driving software in a closed-loop. Read More 18 December 2025 aiMotive and LG to unveil advanced integrated IVI/ADAS controller at CES 2026 aiMotive, a leading developer of advanced artificial intelligence and automated driving software, in collaboration with LG, will introduce a next-generation High-Performing Computing (HPC) Lite platform at CES 2026. Read More 11 December 2025 AI-powered Data Virtualization Comes to Japan aiMotive, a leading provider of advanced automotive AI technologies, has partnered with its Japanese distributor, Macnica, to introduce a new data collection & processing environment powered by the aiData Platform. Read More Join our newsletter Sign up to our LinkedIn newsletter and get our latest news and updates. Subscribe Join our newsletter Sign up to our newsletter and get our latest news and updates. Subscribe Your personal details are safe with us. Contact With Us [email protected] +36 1 7707 201 Follow Us On Social Linkedin Twitter Facebook Offices Hungary Budapest Office Szépvölgyi út 18-22 1025 Budapest, Hungary USA Mountain View Office 1907 Colony Street Mountain View / CA, 94043 Japan Yokohama Office #501 Expert Office Shinyokohama, 3-7-18 Shinyokohama, Kohoku-ku, Yokohama, Kanagawa 222-0033 日本語での連絡はこちら [email protected] Latest News Asset Publisher Scalable Automated Driving and Next-Generation Simulation at CES 2026 7 January 2026 aiMotive and LG to unveil advanced integrated IVI/ADAS controller at CES 2026 18 December 2025 AI-powered Data Virtualization Comes to Japan 11 December 2025 Quick Links Data policies & Cookie consent Test schedule Open positions Contact us Financed project IMS Policy – ISO FAQ Annual energy report Whistleblowing Hotline Stellantis Code of Conduct Stellantis Conflict of Interest ©2015–2026 aiMotive. All rights reserved. Contact With Us [email protected] +36 1 7707 201 Follow Us On Social Linkedin Twitter Facebook Offices Hungary Budapest Office Szépvölgyi út 18-22 1025 Budapest, Hungary Germany Munich Office Wilhelmine-Reichard-Straße 7, 80935 München, Germany USA Mountain View Office 1907 Colony Street Mountain View / CA, 94043 Japan Yokohama Office Shinyokohama UU Building 8F 2-5-2 Shinyokohama Kohoku-ku, Yokohama Kanagawa 222-0033 日本語でのお問い合わせはこちらへ [email protected] Latest News Asset Publisher Scalable Automated Driving and Next-Generation Simulation at CES 2026 7 January 2026 aiMotive and LG to unveil advanced integrated IVI/ADAS controller at CES 2026 18 December 2025 AI-powered Data Virtualization Comes to Japan 11 December 2025 Quick Links Data policies & Cookie consent Media gallery Test Schedule Open positions Contact us Financed projects ISP – 27001 FAQ Annual energy report ©2015–2026 aiMotive. All rights reserved. Hidden We use cookies to deliver personalized content, analyze trends, administer the site, track user movements on the site, and collect demographic information about our user base as a whole. Accept all cookies for the best possible experience on our website or manage your preferences. Visit our Privacy Policy Configuration Accept All Decline All"
    },
    {
      "url": "https://amccs.ai",
      "domain": "amccs.ai",
      "scraped_at": "2026-02-08T12:35:27.651536",
      "error": "HTTPSConnectionPool(host='amccs.ai', port=443): Max retries exceeded with url: / (Caused by NameResolutionError(\"HTTPSConnection(host='amccs.ai', port=443): Failed to resolve 'amccs.ai' ([Errno 11001] getaddrinfo failed)\"))"
    },
    {
      "url": "https://synergon.ai",
      "domain": "synergon.ai",
      "scraped_at": "2026-02-08T12:35:27.351636",
      "title": "Synergon AI",
      "meta_description": "AI-Powered Transformation for Healthcare, Hospitality, Transportation & Technology",
      "headings": {
        "h1": [],
        "h2": [
          "Our Technology Stack",
          "Our AI Solutions",
          "Benefits of AI Integration",
          "Resources",
          "Get in Touch"
        ],
        "h3": [
          "Workflow Automation",
          "AI Chatbots",
          "AI Voice Assistants",
          "Sales & Marketing Automation",
          "Email",
          "Phone",
          "Address"
        ]
      },
      "paragraphs": [
        "Leveraging cutting-edge AI technologies to deliver powerful solutions",
        "Discover how our AI-powered solutions can transform your business operations and drive growth.",
        "Streamline and simplify your business processes. Our workflow automation services use intelligent software and AI algorithms to handle repetitive tasks and complex procedures with minimal human intervention.",
        "Enhance customer service with conversational AI agents. Our AI chatbots engage users in natural, human-like conversations to answer questions, assist with services, and provide support around the clock.",
        "Implement voice-driven interfaces for hands-free convenience. AI voice assistants can interact with users through spoken language – think of it like having a smart Alexa or Siri dedicated to your business.",
        "Accelerate your growth with intelligent sales and marketing tools. We apply AI to automate and optimize your outreach, from lead generation to customer retention.",
        "Discover how AI can transform your business operations",
        "Access our collection of AI resources and guides",
        "Have questions? We'd love to hear from you.",
        "Synergon AI, Bangalore, India"
      ],
      "list_items": [],
      "emails": [
        "info@synergon.in"
      ],
      "phones": [
        "3 3 0 0 0-3-3",
        "81 2 2 0 0 1",
        "19 9-5 5-4-4-3 3"
      ],
      "full_text": "Synergon AI Technology Solutions Case Studies Resources Contact Us Loading... Our Technology Stack Leveraging cutting-edge AI technologies to deliver powerful solutions Our AI Solutions Discover how our AI-powered solutions can transform your business operations and drive growth. Workflow Automation Streamline and simplify your business processes. Our workflow automation services use intelligent software and AI algorithms to handle repetitive tasks and complex procedures with minimal human intervention. AI Chatbots Enhance customer service with conversational AI agents. Our AI chatbots engage users in natural, human-like conversations to answer questions, assist with services, and provide support around the clock. AI Voice Assistants Implement voice-driven interfaces for hands-free convenience. AI voice assistants can interact with users through spoken language – think of it like having a smart Alexa or Siri dedicated to your business. Sales & Marketing Automation Accelerate your growth with intelligent sales and marketing tools. We apply AI to automate and optimize your outreach, from lead generation to customer retention. Loading... Benefits of AI Integration Discover how AI can transform your business operations Loading case studies... Resources Access our collection of AI resources and guides Get in Touch Have questions? We'd love to hear from you. Email info@synergon.in Phone +91 91407 64019 Address Synergon AI, Bangalore, India Name Email Message Send Message"
    },
    {
      "url": "https://ceai.eu",
      "domain": "ceai.eu",
      "scraped_at": "2026-02-08T12:35:27.263385",
      "error": "HTTPSConnectionPool(host='ceai.eu', port=443): Max retries exceeded with url: / (Caused by NameResolutionError(\"HTTPSConnection(host='ceai.eu', port=443): Failed to resolve 'ceai.eu' ([Errno 11002] getaddrinfo failed)\"))"
    }
  ]
}